"b""RT Ashoka's Lions vs Modi's Lions Ashoka had spread Buddhism in China and Modi has banned TikTok in India https://t.co/ZcXEzY\xe2\x80\xa6""","b""RT Deoghar The dream of this airport which was visioned in 2010 has been fulfilled by PM Modi It's a matter of pride for us says\xe2\x80\xa6""",b'RT Today TheAuspices day \xe2\x80\x98Guru Purnima \xe2\x80\x98I meet my Tamil teacher (1967to1979)&amp;Guru Dr Mu Ra alias Mu Ramasamy (94 year )i\xe2\x80\xa6',b'RT Prime Minister Narendra Modi greets the crowd during his roadshow in Deoghar Jharkhand https://t.co/GbfgNrlibJ via NaMo\xe2\x80\xa6',b'RT Prime Minister Narendra Modi called on President Ram Nath Kovind at Rashtrapati Bhavan today https://t.co/BYI836lpAw',b'RT How confident is PM Modi when he says Jiska Shilanyas hum karte hai uska Udghatan bhi hum hee karte hain this is the co\xe2\x80\xa6',b'RT Media reports Modi govt facilitated Sri Lankan President Rajapaksa escape to Maldives on facing public revolt.Though Modi\xe2\x80\xa6',"b""RT In Deoghar huge crowds throng PM's roadshow chant 'Har-Har Modi' https://t.co/17XWvIC1Kg via NaMo App https://t.co/qyr\xe2\x80\xa6""",b'RT This is the original Ashok Stambh at the Sarnath Museum For those crying over what did Modi do to the national emblem at th\xe2\x80\xa6',b'He welcomed modi ji indirectly'
"b""Jharkhand Children welcome PM with 'Modi-Modi chants https://t.co/Ry87bvXJkg via NaMo App https://t.co/88i4VIHOI2""","b'Chats between Shruti modi &amp RC \xf0\x9f\x91\x87\xf0\x9f\x91\x87\xf0\x9f\x91\x87\xf0\x9f\x91\x87 4 bundh coffee m dal k dedo "" NCB should also clearly menti https://t.co/jr6u3NosR4'",b'RT Prime Minister Narendra Modi will inaugurate the Bundelkhand Expressway at Kaitheri village in Orai tehsil of Jalaun district in U\xe2\x80\xa6',b'I really wish to have many more leaders like Alka lamba to ensure this party would remain away https://t.co/0wVcoQUnQm',b'RT On 5th July herself tweeted #AshokStambh similar to one inaugurated by PM Modi And 7 days later outraging\xe2\x80\xa6',b'RT And if this is true and known to authorities then Hamid Ansari is not in jail because of Narendra Modi/BJP',"b""RT Under Dr Manmohan Singh's UPA Debt 56 lac Cr LPG 385 Rs Dollar 58 INR Unemployment 4% Under Mr ND Modi's NDA\xe2\x80\xa6""","b""Deoghar visit PM Modi fulfills people's wishes gets out of his vehicle waves at them https://t.co/aqA4qDCjgV vi https://t.co/GDA6Dg0faF""","b""RT Under Dr Manmohan Singh's UPA Debt 56 lac Cr LPG 385 Rs Dollar 58 INR Unemployment 4% Under Mr ND Modi's NDA\xe2\x80\xa6""",b'RT _ujval This is from THE STATE EMBLEM OF INDIA (PROHIBITION OF IMPROPER USE ACT 2005 Emblem cannot vary from this design.\xe2\x80\xa6'
b'RT Main issues 10 years ago Scams Corruption Inflation Appeasement Terrorism and National Security Main issue now Modi\xe2\x80\xa6',b'RT #WATCH Yashwant Sinha is good candidate Droupadi Murmu is a decent person but she represents evil philosophy of India We shoul\xe2\x80\xa6',"b'RT Chats between Shruti modi &amp RC \xf0\x9f\x91\x87\xf0\x9f\x91\x87\xf0\x9f\x91\x87\xf0\x9f\x91\x87 4 bundh coffee m dal k dedo "" NCB should also clearly mention\xe2\x80\xa6'",b'RT Prime Minister Narendra Modi will inaugurate the Bundelkhand Expressway at Kaitheri village in Orai tehsil of Jalaun district in U\xe2\x80\xa6',"b'RT American citizen and the most bias,mischievous,jealous founder editor Why you always have\xe2\x80\xa6'","b'RT _IN For politics of Nehru-Gandhi family Mrs Sonia Gandhi destroyed Congress For agenda of RSS parivar,Modi and BJP destr\xe2\x80\xa6'","b""RT Under Dr Manmohan Singh's UPA Debt 56 lac Cr LPG 385 Rs Dollar 58 INR Unemployment 4% Under Mr ND Modi's NDA\xe2\x80\xa6""","b""RT A matter of honour Mithali Raj recalls how Narendra Modi motivated women's team after loss in 2017 WC final https://t.co/\xe2\x80\xa6""",b'RT Erstwhile Sri Lankan President regularly use to took economic advice from Subramanian Swamy while PM Modi royally ignored\xe2\x80\xa6',"b""Jharkhand Children welcome PM with 'Modi-Modi chants https://t.co/Ry87bvXJkg via NaMo App https://t.co/88i4VIHOI2"""
b'RT MODI JI KA NEW INDIA \xf0\x9f\x87\xae We proud on our foreign minister https://t.co/hXXIitc7Ow',b'RT PM Modi has undertaken 110 known foreign trips in last 8 years and Rahul Gandhi 247 unknown foreign trips in last 5 years.\xe2\x80\xa6',b'RT #WATCH Yashwant Sinha is good candidate Droupadi Murmu is a decent person but she represents evil philosophy of India We shoul\xe2\x80\xa6',b'Hopefully Mr Ghandhi and his team will try to be in sync with reality India in Too 10 STOP Modi Bas https://t.co/gEM95VvMDl',b'RT MODI JI KA NEW INDIA \xf0\x9f\x87\xae We proud on our foreign minister https://t.co/hXXIitc7Ow',b'RT It\xe2\x80\x99s actually kind of strange that nobody from Mohammed Zubair\xe2\x80\x99s family . Father Mother or nobody has come forward in the\xe2\x80\xa6',b'RT \xe2\x80\x98Modi-Mitr Sarkar at its crony best! For \xe2\x80\x98ease of snatching forest land BJP govt has come up with new FC Rules 2022 d\xe2\x80\xa6',b'RT Modi Ji appeals to the Prime minister https://t.co/EJ6iHGGuEC',b'RT _Ramesh this clip has been cut short but you clearly said that she represents evil p\xe2\x80\xa6',b'RT _digital PM Modi speaks to Dutch counterpart Mark Rutte discusses bilateral ties Read Story https://t.co/cCi9xRKkiP #PMMod\xe2\x80\xa6'
b'_protein _musings Bro I thought I saw someone say that Chandigarh is not a part of Punjab Because who wo https://t.co/SBJzR1BnC5',b'RT Patna lines up to welcome Prime Minister Modi https://t.co/ll6pDV2xQr',b'RT _paresh Poor ex-VP forced to deny crap allegations despite all visits/meetings being official only because he\xe2\x80\x99s a Muslim By this l\xe2\x80\xa6',b'Importance of India can into light recently when Mr Modi was pushed to corner in G18 pic while he was d https://t.co/6KCBVwrWcA',b'RT Pathetic creature on earth is Indian oppositions who wants to see india in same condition of current #SriLanka is they wa\xe2\x80\xa6',"b""Jharkhand Children welcome PM with 'Modi-Modi chants https://t.co/ATzJrFj5OV https://t.co/KZ3NxlMZh0""","b'RT The country is still waiting for ""Achhe Din Modi ji. #\xe0\xa4\xae\xe0\xa5\x8b\xe0\xa4\xa6\xe0\xa5\x80_\xe0\xa4\xae\xe0\xa4\x82\xe0\xa4\xa6\xe0\xa5\x80_\xe0\xa4\x94\xe0\xa4\xb0_\xe0\xa4\xae\xe0\xa4\xb9\xe0\xa4\x82\xe0\xa4\x97\xe0\xa4\xbe https://t.co/5EypUnwlsr'",b'RT Modi govt helped chairpersons of &amp get a 2nd term by amending appt rules Both chairpersons have alli\xe2\x80\xa6',b'RT __Rawat Great Achievements of PM Modi &amp Bjp Government !\xf0\x9f\x99\x83 #\xe0\xa4\x86\xe0\xa4\xa4\xe0\xa4\x82\xe0\xa4\x95\xe0\xa4\xb5\xe0\xa4\xbe\xe0\xa4\xa6\xe0\xa5\x80_\xe0\xa4\xad\xe0\xa4\xbe\xe0\xa4\x9c\xe0\xa4\xaa\xe0\xa4\xbe\xe0\xa4\x88_\xe0\xa4\xad\xe0\xa4\xbe\xe0\xa4\x88_\xe0\xa4\xad\xe0\xa4\xbe #bjp_means_\xe0\xa4\xac\xe0\xa4\xb0\xe0\xa5\x8d\xe0\xa4\xac\xe0\xa4\xbe\xe0\xa4\xa6 https://t.co/TR9at1pGFs',b'RT PM Modi has undertaken 110 known foreign trips in last 8 years and Rahul Gandhi 247 unknown foreign trips in last 5 years.\xe2\x80\xa6'
"b'RT Chats between Shruti modi &amp RC \xf0\x9f\x91\x87\xf0\x9f\x91\x87\xf0\x9f\x91\x87\xf0\x9f\x91\x87 4 bundh coffee m dal k dedo "" NCB should also clearly mention tha\xe2\x80\xa6'",b'RT The \xe2\x80\x98liberals seething in rage on seeing PM Modi wearing his Hindu identity on sleeves is so satisfying take\xe2\x80\xa6',b'RT Adani has invested in ports airports cement coal green energy etc and is accruing some benefits. But it is the inves\xe2\x80\xa6',"b'Modi govt blasts \'experts over Ashokan Lions criticism \'sense of proportion.\' https://t.co/kG9pFIDIQg Source "" https://t.co/rRPa3uvdhg'",b'RT Can someone kindly explain what is Mr Modi doing https://t.co/KddTL64ZNR',b'RT _ujval This is from THE STATE EMBLEM OF INDIA (PROHIBITION OF IMPROPER USE ACT 2005 Emblem cannot vary from this design.\xe2\x80\xa6',b'RT Can someone kindly explain what is Mr Modi doing https://t.co/KddTL64ZNR',"b""RT Under Dr Manmohan Singh's UPA Debt 56 lac Cr LPG 385 Rs Dollar 58 INR Unemployment 4% Under Mr ND Modi's NDA\xe2\x80\xa6""",b'RT _Er 6 AltNews Model First Spread a Fake News then Fact Check it Posted fake news website link which claimed Narendra Modi as\xe2\x80\xa6',b'RT PM Modi has undertaken 110 known foreign trips in last 8 years and Rahul Gandhi 247 unknown foreign trips in last 5 years.\xe2\x80\xa6'
b'RT Known as \xe2\x80\x9cLand of Waterfalls 250 Cascade Near Brevard Western North Carolina Some of the area waterfalls have sta\xe2\x80\xa6',b'RT Known as \xe2\x80\x9cLand of Waterfalls 250 Cascade Near Brevard Western North Carolina Some of the area waterfalls have sta\xe2\x80\xa6',b'RT _Shill Lest we forget Huey was in the Hunger Games https://t.co/iwS1sBJnOk',b'RT Petition to start the Hunger Games but with billionaires',b'The Hunger Games began',b'Right you lot I\xe2\x80\x99ve had it I get we want the tories to tear each other to pieces during this leadership campaign b https://t.co/h6rIZxawyM',b'Adding fuel to the fire This isn\xe2\x80\x99t the Hunger Games Get it together!',b'we grew up reading the hunger games and percy jackson what did yall expect? https://t.co/Ux6dA0RioC',b'Getting a lash appointment is like the hunger games \xf0\x9f\x98\x85',"b""RT I'd like to see the remainder of the Tory top narcissist competition run like The Hunger Games"""
b'RT _ Panem\xe2\x80\x99s lethal lovers \xf0\x9f\x94\xa5 #AtsuSuna x Hunger Games AU https://t.co/vgze6caYf0',b'RT _ Panem\xe2\x80\x99s lethal lovers \xf0\x9f\x94\xa5 #AtsuSuna x Hunger Games AU https://t.co/vgze6caYf0',b'RT Known as \xe2\x80\x9cLand of Waterfalls 250 Cascade Near Brevard Western North Carolina Some of the area waterfalls have sta\xe2\x80\xa6',b'RT Known as \xe2\x80\x9cLand of Waterfalls 250 Cascade Near Brevard Western North Carolina Some of the area waterfalls have sta\xe2\x80\xa6',b'RT _Shill Lest we forget Huey was in the Hunger Games https://t.co/iwS1sBJnOk',b'RT Petition to start the Hunger Games but with billionaires',b'The Hunger Games began',b'Right you lot I\xe2\x80\x99ve had it I get we want the tories to tear each other to pieces during this leadership campaign b https://t.co/h6rIZxawyM',b'Adding fuel to the fire This isn\xe2\x80\x99t the Hunger Games Get it together!',b'we grew up reading the hunger games and percy jackson what did yall expect? https://t.co/Ux6dA0RioC'
b'RT Known as \xe2\x80\x9cLand of Waterfalls 250 Cascade Near Brevard Western North Carolina Some of the area waterfalls have sta\xe2\x80\xa6',b'announce hunger games',b'Melloa! I wanna Attempt to draw as many Stupid Scenarios as I can from this Hunger Games Sim https://t.co/JXG6Aqq0ZJ',b'hunger games coach carter the blindside senior year wild child clueless the notebook',b'RT _ Panem\xe2\x80\x99s lethal lovers \xf0\x9f\x94\xa5 #AtsuSuna x Hunger Games AU https://t.co/vgze6caYf0',b'RT _ Panem\xe2\x80\x99s lethal lovers \xf0\x9f\x94\xa5 #AtsuSuna x Hunger Games AU https://t.co/vgze6caYf0',b'RT Known as \xe2\x80\x9cLand of Waterfalls 250 Cascade Near Brevard Western North Carolina Some of the area waterfalls have sta\xe2\x80\xa6',b'RT Known as \xe2\x80\x9cLand of Waterfalls 250 Cascade Near Brevard Western North Carolina Some of the area waterfalls have sta\xe2\x80\xa6',b'RT _Shill Lest we forget Huey was in the Hunger Games https://t.co/iwS1sBJnOk',b'RT Petition to start the Hunger Games but with billionaires'
b'RT 6 IAMC was established in the USA after the 2002 riots Riots were started after 59 Karsevaeks were burnt alive in 2002 b\xe2\x80\xa6',b'RT How confident is PM Modi when he says Jiska Shilanyas hum karte hai uska Udghatan bhi hum hee karte hain this is the co\xe2\x80\xa6',b'RT MODI JI KA NEW INDIA \xf0\x9f\x87\xae We proud on our foreign minister https://t.co/hXXIitc7Ow',"b'RT Chats between Shruti modi &amp RC \xf0\x9f\x91\x87\xf0\x9f\x91\x87\xf0\x9f\x91\x87\xf0\x9f\x91\x87 4 bundh coffee m dal k dedo "" NCB should also clearly mention tha\xe2\x80\xa6'","b'RT When Modi Adani want it, Yogi has to do it https://t.co/cU4KcTFWZd'","b'RT Chats between Shruti modi &amp RC \xf0\x9f\x91\x87\xf0\x9f\x91\x87\xf0\x9f\x91\x87\xf0\x9f\x91\x87 4 bundh coffee m dal k dedo "" NCB should also clearly mention\xe2\x80\xa6'",b'Look Nehur was appointed 1st PM Even then he ran India as he envisioned Modi is elected by the p https://t.co/X7LzQ9nlC2',b'Itna dar?! Fact checker exposing the fake propoganda of modi and gang!',"b""RT A matter of honour Mithali Raj recalls how Narendra Modi motivated women's team after loss in 2017 WC final https://t.co/\xe2\x80\xa6""",b'RT PM modi will inaugurate In-Patient Department (IPD &amp Operation Theatre services in #AIIMS Deoghar through online on Ju\xe2\x80\xa6',b'RT MODI JI KA NEW INDIA \xf0\x9f\x87\xae We proud on our foreign minister https://t.co/hXXIitc7Ow',b'_hindu Indians splurging on Chinese phones &amp gadgets toys &amp home essentials will now act patri https://t.co/a1OcTgESfe',"b""RT #Uttarakhand becomes the first state in India to start \xe2\x80\x98Bal Vatika as per BJP Govt's New Education Policy. Kids will recei\xe2\x80\xa6""","b'After 10JP ecosystem failed spectacularly when they tried paint India derisively as ""Hindu Pakistan"" now the same https://t.co/Sy8tyrpnzr'",b'RT Simply put Opposition has run out of ideas Modi has checkmated them at every step He has delivered on many projects whic\xe2\x80\xa6',b'RT Can someone kindly explain what is Mr Modi doing https://t.co/KddTL64ZNR',b'RT Can someone kindly explain what is Mr Modi doing https://t.co/KddTL64ZNR',b'. &amp Harsh V Pant discuss #Modi at the #G7 The #BRICS Tango #India and the #ASEAN and #RajnathSingh i https://t.co/StAICdKhLd',b'The lion stood for the economic agenda of the Modi govt The \xe2\x80\x9cMake in India logo pushed out soon after the BJP cam https://t.co/XJ820q0l6v',b'Read Manmohan in place of Modi'
b'RT _Er 6 AltNews Model First Spread a Fake News then Fact Check it Posted fake news website link which claimed Narendra Modi as\xe2\x80\xa6',b'RT PM Modi has undertaken 110 known foreign trips in last 8 years and Rahul Gandhi 247 unknown foreign trips in last 5 years.\xe2\x80\xa6',"b'RT As Abe\'s funeral is held Modi pays homage to his slain friend ""Every meeting with Abe-san was intellectually stimulating.\xe2\x80\xa6'",b'This is what Modi wants for you to give away confidence so that other sheeps vote him https://t.co/QnxzIjelMO',b'RT Can someone kindly explain what is Mr Modi doing https://t.co/KddTL64ZNR',b'RT Modi ji Coal Crisis created by you is benefiting your friend ? #KCRQuestionsModi https://t.co/sfVhKjunMZ',b'\xe2\x80\xa2Prime Minister Narendra Modi to virtually participate in First I2U2(India Israel UAE USA Summit along with I https://t.co/Vobxo5tBDg',b'RT US inflation touches 40 year high at 9.1% Eurozone inflation at 8.6% Indian liberal experts Why has Modi failed to con\xe2\x80\xa6',b'_X9 Then make a me Why hasn\xe2\x80\x99t one Muslim become PM You harass and target name sake Muslim actors Shah rukh https://t.co/0j5ciMaXOw',"b'RT Chats between Shruti modi &amp RC \xf0\x9f\x91\x87\xf0\x9f\x91\x87\xf0\x9f\x91\x87\xf0\x9f\x91\x87 4 bundh coffee m dal k dedo "" NCB should also clearly mention\xe2\x80\xa6'",b'Modi ji Walks casually Opposition He is breaking the law Ruining the country.',"b""RT I won't be surprise if tommorrow Modi change the color of National Flag.""",b'RT \xe2\x80\x98Modi-Mitr Sarkar at its crony best! For \xe2\x80\x98ease of snatching forest land BJP govt has come up with new FC Rules 2022 d\xe2\x80\xa6',b'RT _hindu PM modi is set to inaugurate 296Km long Bundelkhand expressway on 16th July. Currently Uttarpardesh has Five operational\xe2\x80\xa6',"b""This is what it looks like inside Modi Ji's mouth when he opens it https://t.co/rwQBKTWpVJ""",b'RT Whole BJP IT Cell is busy propagating Modi ji as Lion and Rupee touches all time low just like their mental status...',b'RT Will be doing a Press Conference on \xe2\x80\x9cWhy does ED look the other way in case of Modi ji\xe2\x80\x99s friends at 11:00 AM on June\xe2\x80\xa6',b'RT CM Modi is asking PM Modi some very valid Questions https://t.co/m4P7oTtTzs',b'RT This is why we need to keep Yogi ji and Modi Ji in power for another 10 years at least The entire system is anti Hindus!',"b""RT Dr , We didn't ditch _in . Modi ditched the ideals for which we voted for\xe2\x80\xa6"""
b'RT Modi Ji appeals to the Prime minister https://t.co/EJ6iHGGuEC',b'RT Modi Ji appeals to the Prime minister https://t.co/EJ6iHGGuEC',"b""RT Under Dr Manmohan Singh's UPA Debt 56 lac Cr LPG 385 Rs Dollar 58 INR Unemployment 4% Under Mr ND Modi's NDA\xe2\x80\xa6""","b'RT If JumlaJeevi is unparliamentary then what about Andolan Jeevi ?\xf0\x9f\xa4\x94 How can ""Hypocrisy be unparliamentary it is Modi ji\'s\xe2\x80\xa6'",b'#PMModi #NaMoron #rt 1 author encyclopedia site:Modi in power as #PM Should Muslims fear Him https://t.co/KP7skYC0Er https://t.co/Szk12yJPNa',b'RT Can someone kindly explain what is Mr Modi doing https://t.co/KddTL64ZNR',"b""RT A matter of honour Mithali Raj recalls how Narendra Modi motivated women's team after loss in 2017 WC final https://t.\xe2\x80\xa6""","b""RT Under Dr Manmohan Singh's UPA Debt 56 lac Cr LPG 385 Rs Dollar 58 INR Unemployment 4% Under Mr ND Modi's NDA\xe2\x80\xa6""","b""RT Hello will Sindh treat pashtuns as Modi's bhakts treats Muslims Do you agree with it\xe2\x80\xa6""",b'Those who do politics of short-cut never build new airports highways medical colleges PM https://t.co/wacTnEVyqY https://t.co/8a4XdqICDV'
b'RT _Er 6 AltNews Model First Spread a Fake News then Fact Check it Posted fake news website link which claimed Narendra Modi as\xe2\x80\xa6',b'RT Erstwhile Sri Lankan President regularly use to took economic advice from Subramanian Swamy while PM Modi royally ignored\xe2\x80\xa6',b'RT Today you not only get the final decision but you also get the mentality of _NTA and Modi government The adv who wi\xe2\x80\xa6',b'RT Prime Minister Narendra Modi will inaugurate the Bundelkhand Expressway at Kaitheri village in Orai tehsil of Jalaun district in U\xe2\x80\xa6',b'Kerala according to bhakts are not as developed and vibrant as Gujrat ..Gujrat was https://t.co/vhFbwPNVAb',"b""RT Hello will Sindh treat pashtuns as Modi's bhakts treats Muslims Do you agree with it\xe2\x80\xa6""",b'_samal So MMS was not the PM of India before Modi When you don\xe2\x80\x99t res https://t.co/54AlJMWLX2',b'Modi should immediately Sack Amit.',"b""RT Hello will Sindh treat pashtuns as Modi's bhakts treats Muslims Do you agree with it\xe2\x80\xa6""",b'RT MODI JI KA NEW INDIA \xf0\x9f\x87\xae We proud on our foreign minister https://t.co/hXXIitc7Ow'
b'THAT ONE SOMG FROM THE HUNGER GAMES',b'More Mad Max vs Hunger Games',b'Man I love both but the Hunger Games books and films were my shit \xf0\x9f\x98\xad',b'RT put them in an arena hunger games style and they\xe2\x80\x99ll just be so nice to each other until someone wins https://t.co/I7ItgRU\xe2\x80\xa6',b'RT _churchill Its bascially what David icke talked about Haha Hunger games society where only a handful of people have\xe2\x80\xa6',b'RT _Shill Lest we forget Huey was in the Hunger Games https://t.co/iwS1sBJnOk',"b'RT WOW whittling down,Tory leadership is very dangerous times for UK!all agree to carry on inhumane RWANDA policy,some want bl\xe2\x80\xa6'","b'RT ""There\xe2\x80\x99s a tradition of literary tomboys Jo March (Little Women Scout Finch (To Kill a Mockingbird Katniss Everdeen (Hung\xe2\x80\xa6'",b'Hunger games?',b'_OW Well they just made one like two hours ago for a hunger games thing'
b'RT _com Udaipur murder Dawat-e-Islami had formed team of 40 people in Rajasthan to behead Nupur Sharma supporters in Taliban styl\xe2\x80\xa6',b'RT _com Udaipur murder Dawat-e-Islami had formed team of 40 people in Rajasthan to behead Nupur Sharma supporters in Taliban styl\xe2\x80\xa6',b'RT Dawat-e-Islami had formed team of 40 people in Rajasthan to beh\xc3\xa8ad Nupur Sharma supporters in Talban style. The terr\xc3\xb8\xe2\x80\xa6',b'RT _com Udaipur murder Dawat-e-Islami had formed team of 40 people in Rajasthan to behead Nupur Sharma supporters in Taliban styl\xe2\x80\xa6',b'RT _Analyzer Shocking Revelation: Intention of Pak Sleeper Cell was to kill every supporter of Nupur Sharma Jamaat-e-Islami of\xe2\x80\xa6',b'RT Dawat-e-Islami had formed team of 40 people in Rajasthan to beh\xc3\xa8ad Nupur Sharma supporters in Talban style. The terr\xc3\xb8\xe2\x80\xa6',b'Shame on Adil chishti he is again Insulting on other religions publicaly fir agar kisi nupur sha https://t.co/bqB67gFico',b'RT Can you believe that a team was formed to ki!l Hindus? Yes NIA investigation revealed that Pakistani organization Dawat-e-Isl\xe2\x80\xa6',b'RT Khadim of Ajmer Dargah Salman Chishti announced via video that he would hand over his house to anyone who brings Nupur Sharm\xe2\x80\xa6',b'RT Can you believe that a team was formed to ki!l Hindus? Yes NIA investigation revealed that Pakistani organization Dawat-e-Isl\xe2\x80\xa6'
b'RT _com For three days 4 of us at OpIndia spent hours going through the timeline of Alt News cofounder Mohammad Zubair from 27 Ma\xe2\x80\xa6',b'RT \xe2\x9a\xa1 Rajasthan Pakistan based Terror group Daawat-e-Islami formed a group of 40-people to behead supporters of Nupur Shar\xe2\x80\xa6',b'RT BREAKING Attorney General for India REFUSES to grant consent for initiating contempt action against Advocate _nujs\xe2\x80\xa6',b'RT Dawat-e-Islami had formed team of 40 people in Rajasthan to beh\xc3\xa8ad Nupur Sharma supporters in Talban style. The terr\xc3\xb8\xe2\x80\xa6',b'RT Can you believe that a team was formed to ki!l Hindus? Yes NIA investigation revealed that Pakistani organization Dawat-e-Isl\xe2\x80\xa6',b'RT _com Udaipur murder Dawat-e-Islami had formed team of 40 people in Rajasthan to behead Nupur Sharma supporters in Taliban styl\xe2\x80\xa6',b'RT _com Udaipur murder Dawat-e-Islami had formed team of 40 people in Rajasthan to behead Nupur Sharma supporters in Taliban styl\xe2\x80\xa6',b'RT _com Udaipur murder Dawat-e-Islami had formed team of 40 people in Rajasthan to behead Nupur Sharma supporters in Taliban styl\xe2\x80\xa6',b'RT Dawat-e-Islami had formed team of 40 people in Rajasthan to beh\xc3\xa8ad Nupur Sharma supporters in Talban style. The terr\xc3\xb8\xe2\x80\xa6',b'RT _com Udaipur murder Dawat-e-Islami had formed team of 40 people in Rajasthan to behead Nupur Sharma supporters in Taliban styl\xe2\x80\xa6'
b'RT _com For three days 4 of us at OpIndia spent hours going through the timeline of Alt News cofounder Mohammad Zubair from 27 Ma\xe2\x80\xa6',b'RT \xe2\x9a\xa1 Rajasthan Pakistan based Terror group Daawat-e-Islami formed a group of 40-people to behead supporters of Nupur Shar\xe2\x80\xa6',b'RT BREAKING Attorney General for India REFUSES to grant consent for initiating contempt action against Advocate _nujs\xe2\x80\xa6',b'RT Dawat-e-Islami had formed team of 40 people in Rajasthan to beh\xc3\xa8ad Nupur Sharma supporters in Talban style. The terr\xc3\xb8\xe2\x80\xa6',b'RT Can you believe that a team was formed to ki!l Hindus? Yes NIA investigation revealed that Pakistani organization Dawat-e-Isl\xe2\x80\xa6',b'RT _com Udaipur murder Dawat-e-Islami had formed team of 40 people in Rajasthan to behead Nupur Sharma supporters in Taliban styl\xe2\x80\xa6',b'RT _com Udaipur murder Dawat-e-Islami had formed team of 40 people in Rajasthan to behead Nupur Sharma supporters in Taliban styl\xe2\x80\xa6',b'RT _com Udaipur murder Dawat-e-Islami had formed team of 40 people in Rajasthan to behead Nupur Sharma supporters in Taliban styl\xe2\x80\xa6',b'RT Dawat-e-Islami had formed team of 40 people in Rajasthan to beh\xc3\xa8ad Nupur Sharma supporters in Talban style. The terr\xc3\xb8\xe2\x80\xa6',b'RT _com Udaipur murder Dawat-e-Islami had formed team of 40 people in Rajasthan to behead Nupur Sharma supporters in Taliban styl\xe2\x80\xa6',b'RT _Analyzer Shocking Revelation: Intention of Pak Sleeper Cell was to kill every supporter of Nupur Sharma Jamaat-e-Islami of\xe2\x80\xa6',b'RT Dawat-e-Islami had formed team of 40 people in Rajasthan to beh\xc3\xa8ad Nupur Sharma supporters in Talban style. The terr\xc3\xb8\xe2\x80\xa6',b'Shame on Adil chishti he is again Insulting on other religions publicaly fir agar kisi nupur sha https://t.co/bqB67gFico',b'RT Can you believe that a team was formed to ki!l Hindus? Yes NIA investigation revealed that Pakistani organization Dawat-e-Isl\xe2\x80\xa6',b'RT Khadim of Ajmer Dargah Salman Chishti announced via video that he would hand over his house to anyone who brings Nupur Sharm\xe2\x80\xa6',b'RT Can you believe that a team was formed to ki!l Hindus? Yes NIA investigation revealed that Pakistani organization Dawat-e-Isl\xe2\x80\xa6',b'Shame on Adil chishti he is again Insulting on other religions publicaly fir agar kisi nupur shar https://t.co/onDwdw9i8X',b'RT _com Udaipur murder Dawat-e-Islami had formed team of 40 people in Rajasthan to behead Nupur Sharma supporters in Taliban styl\xe2\x80\xa6',b'RT US inflation surges to 9.1% the highest in 40 years Many economic experts in US are blaming Nupur Sharma for this.',b'RT Can you believe that a team was formed to ki!l Hindus? Yes NIA investigation revealed that Pakistani organization Dawat-e-Isl\xe2\x80\xa6'
